category,title,creator,publication_year,description
book,American Light,Msgr. Milo Koch,2011,Suscipit expedita est laborum.
movie,Seattle Light,Hyun Grady,1938,Dicta esse laboriosam inventore.
movie,Heart Symphony,Karmen Cummerata,1935,Mollitia distinctio dolorem quia.
album,Green Town,Danille Osinski,1926,Impedit et soluta veritatis.
album,Brooklyn Mug,Thurman Hills,1972,Quis est laboriosam aut.
album,Spilt Delight,Lacy Beer,1975,Ut expedita quia nobis.
book,Blacktop Nuts,Amb. Duane Weimann,1959,Quam amet et qui.
album,Hello Enlightenment,Jonathan Stanton,1948,Nihil vel aut ut.
book,Strong Breaker,Keira Nikolaus,1972,Fugit mollitia ipsum consequatur.
album,Split Bean,Jerilyn Lynch CPA,1929,Nisi soluta excepturi nobis.
album,Blue Solstice,Hyacinth Erdman,1933,Sit laboriosam est voluptas.
movie,Blue Treat,Thora Feil,1992,Qui aut commodi aliquam.
album,Captain's Select,Martin Waters DC,1935,Et itaque expedita nesciunt.
album,KrebStar Forrester,Misha Funk,1952,Libero accusamus aut voluptates.
album,Summer Treat,Rosaline Ritchie,2012,Architecto eaque modi pariatur.
book,Postmodern Extract,Rashad Harvey,1927,In voluptatem enim deleniti.
movie,Green Cake,Erminia Hauck,1992,Nihil sed ullam ratione.
movie,Café Solstice,Annamaria Dooley DVM,1975,Facere voluptas sit non.
movie,Joe Forrester,Clinton Brown,1948,Molestiae est consequatur expedita.
movie,Express Treat,Evan Aufderhar,1967,Eum molestias et explicabo.
book,Heart Treat,Boyd Von,1989,Eius et ipsa tenetur.
book,The Captain's Extract,Phyliss McCullough,1965,Totam praesentium magnam veniam.
movie,KrebStar Been,Mrs. Bryce Kilback,1934,Dolorem hic numquam expedita.
book,Melty Breaker,Prof. Bradley Lindgren,1985,Facilis temporibus aut ipsam.
album,Heart Select,Eula Hayes,1965,Aspernatur omnis qui aut.
